{
  "name": "lens.report",
  "version": 1,
  "title": "Data report",
  "description": "The stage the lens pipeline enters on report_requested: collect on economy, write on strong (data.md §2g's explore then answer). The writer is a sub-agent so the two tiers live in one run with one result.",
  "owner": {
    "type": "team",
    "id": "data-platform"
  },
  "extends": {
    "name": "lens.investigate",
    "version": 1
  },
  "params": {
    "question": {
      "type": "string",
      "trust": "principal",
      "required": true,
      "max_length": 4000
    }
  },
  "spec": {
    "model": {
      "tier": "economy",
      "max_tier": "strong"
    },
    "system_prompt": {
      "base": {
        "ref": {
          "name": "lens.report.collect",
          "version": 1
        }
      },
      "generated": [
        "env",
        "capabilities",
        "data_overview"
      ]
    },
    "inputs": [
      {
        "name": "question",
        "kind": "instruction",
        "source": {
          "param": "question"
        },
        "trust": "principal"
      },
      {
        "name": "prior_attempt",
        "kind": "prior_attempt",
        "source": {
          "carry": "prior_attempt"
        },
        "trust": "harness",
        "required": false
      }
    ],
    "completion": {
      "form": "tool",
      "statuses": [
        "done",
        "failed",
        "budget_exhausted"
      ],
      "report_schema": {
        "ref": {
          "name": "lens.report.document",
          "version": 1
        }
      },
      "checks": [
        {
          "id": "provenance_closure"
        }
      ]
    },
    "hatches": null,
    "outputs": {
      "sinks": [
        {
          "id": "publish",
          "kind": "artifact_publish",
          "when": {
            "terminal": [
              "complete"
            ],
            "status": [
              "done"
            ]
          },
          "render": {
            "template": "{{report.document_markdown}}",
            "attach": [
              "evidence"
            ]
          }
        }
      ]
    },
    "agents": {
      "orchestrator": {
        "grant": [
          "sql.core",
          "sql.extended"
        ],
        "spawns": [
          "writer"
        ],
        "max_concurrent_children": 1
      },
      "writer": {
        "description": "Writes the report from the refs you collected. Pass the refs and the question; it cannot query.",
        "prompt": {
          "base": {
            "ref": {
              "name": "lens.report.write",
              "version": 1
            }
          },
          "generated": [
            "env",
            "capabilities"
          ]
        },
        "model": {
          "tier": "strong",
          "clamp_to_parent": false
        },
        "grant": []
      }
    }
  }
}
